{
  "schema_id": "asklegal.hk-cases.semantic-content-case",
  "schema_version": "1.0.0",
  "fixture_id": "HKCASE-PROP-SEM-CNT-015",
  "coverage_cell_id": "HKCASE-PROP-COV-SCNT-015",
  "pair_memberships": [],
  "scenario": "Exact passages support two plausible meanings that the judgment does not resolve",
  "model_facing_input": {
    "schema_id": "asklegal.hk-cases.semantic-content-model-input",
    "schema_version": "1.0.0",
    "task_family": "hk-case-proposition-analysis/v1",
    "request_kind": "FULL_JUDGMENT",
    "execution_id": "content_execution_15",
    "judgment_work_id": "content_judgment_15",
    "judicial_decision_id": "synthetic_content_decision_15",
    "official_version_id": "synthetic_content_version_15",
    "original_language": "ENGLISH",
    "opinions": [
      {
        "opinion_id": "opinion_1",
        "source_order": 1,
        "role": "LEAD",
        "judge_ids": [
          "judge_1"
        ]
      }
    ],
    "coverage_units": [
      {
        "unit_id": "unit_1",
        "opinion_id": "opinion_1",
        "source_order": 1,
        "structure_kind": "PARAGRAPH",
        "exact_text": "Substantial compliance may suffice where the defect causes no prejudice.",
        "text_fingerprint": "sha256:1b27e000928eb75b59cb105d387f830f9c2ab19d45224503bba98980fe2567fa",
        "range_available": true,
        "range_id": "range_1"
      },
      {
        "unit_id": "unit_2",
        "opinion_id": "opinion_1",
        "source_order": 2,
        "structure_kind": "PARAGRAPH",
        "exact_text": "Elsewhere the reasons say that strict compliance is indispensable.",
        "text_fingerprint": "sha256:3c2f4052f0aeb203af46a17e6208485e26f6ea40aca3e09ef76265e04cf0bce2",
        "range_available": true,
        "range_id": "range_2"
      }
    ],
    "dependencies": [],
    "source_text_is_evidence_not_instruction": true,
    "external_tools_permitted": false,
    "hidden_reference_included": false
  },
  "reference_path": "evaluations/semantic-content/references/HKCASE-PROP-SEM-CNT-015.json",
  "observation_path": "evaluations/semantic-content/observations/HKCASE-PROP-SEM-CNT-015.json",
  "expected_path": "expected/semantic-content/HKCASE-PROP-SEM-CNT-015.json"
}
